id,level,rule_txt,rule_image,rule_video
1,1,Hvilket greb i klatring er det nemmeste at gribe fat i?,null,null
2,2,Hvad er et flash?,null,null
3,3,Hvor mange minutter får en klatrer til at gennemføre et problem?,null,null
4,4,Hvornår har en klatrer gennemført et problem?,null,null
5,5,Hvad kalder man denne væg?,null,null
6,6,Hvornår har en klatrer brugt et forsøg?,null,null
7,7,Hvor mange forsøg har en klatrer til et problem?,null,null
8,8,Hvor mange forsøg skal man bruge for at vinde en bouldering konkurrence?,null,null
